{
  "id": "s1-g03",
  "book": "s1",
  "area": "지리",
  "no": 3,
  "title": "유럽",
  "icon": "city",
  "accent": "magenta",
  "impact3d": 2,
  "standardsVerified": true,
  "lessons": [
    {
      "id": "s1-g03-1",
      "title": "유럽의 위치와 자연환경",
      "standard": {
        "code": "9사(지리)03-01",
        "text": "다양한 지리 정보와 매체를 활용하여 유럽의 국가와 주요 도시의 위치를 파악하고 자연환경의 특성을 지도로 표현한다.",
        "verified": true
      },
      "lab": {
        "type": "globe",
        "params": {
          "focus": [
            50,
            12
          ],
          "highlight": "europe"
        }
      },
      "predict": {
        "q": "런던은 서울보다 훨씬 북쪽(북위 51°)에 있다. 런던의 1월 평균 기온은?",
        "choices": [
          "서울보다 훨씬 춥다",
          "서울보다 따뜻하다",
          "서울과 비슷하다",
          "영하 20℃ 이하"
        ],
        "answer": 1,
        "reveal": "런던의 1월 평균 기온은 약 5℃로 서울(약 -2℃)보다 따뜻하다. 북대서양 해류와 편서풍이 바다의 열을 유럽으로 실어 오기 때문이다."
      },
      "concepts": [],
      "quiz": []
    },
    {
      "id": "s1-g03-2",
      "title": "기후위기와 지속가능한 도시",
      "standard": {
        "code": "9사(지리)03-02",
        "text": "다양한 유형의 유럽 도시를 탐색하고, 기후위기에 대응하여 지속가능한 도시를 만들기 위한 노력을 조사한다.",
        "verified": true
      },
      "concepts": [],
      "quiz": []
    },
    {
      "id": "s1-g03-3",
      "title": "유럽의 통합과 분리",
      "standard": {
        "code": "9사(지리)03-03",
        "text": "지역 간 역학관계에 따른 유럽의 통합과 분리의 움직임이 유럽연합의 변화와 주민 생활에 미치는 영향을 탐색한다.",
        "verified": true
      },
      "concepts": [],
      "quiz": []
    }
  ],
  "geo": {
    "lat": 50,
    "lng": 12
  }
}