{
  "id": "s1-g02",
  "book": "s1",
  "area": "지리",
  "no": 2,
  "title": "아시아",
  "icon": "temple",
  "accent": "sky",
  "impact3d": 3,
  "standardsVerified": true,
  "lessons": [
    {
      "id": "s1-g02-1",
      "title": "아시아의 위치와 자연환경",
      "standard": {
        "code": "9사(지리)02-01",
        "text": "다양한 지리 정보와 매체를 활용하여 아시아의 국가와 주요 도시의 위치를 파악하고 자연환경의 특성을 지도로 표현한다.",
        "verified": true
      },
      "lab": {
        "type": "globe",
        "params": {
          "focus": [
            32,
            95
          ],
          "highlight": "asia"
        }
      },
      "predict": {
        "q": "아시아의 많은 지역에서 여름에 비가 몰려 내리는 이유는?",
        "choices": [
          "사막이 많아서",
          "바다에서 계절풍(몬순)이 불어와서",
          "극지방과 가까워서",
          "산이 없어서"
        ],
        "answer": 1,
        "reveal": "여름에는 바다에서 대륙으로 습한 계절풍이 불어 비가 많이 내린다. 남아시아·동남아시아·동아시아가 대표적이다."
      },
      "concepts": [],
      "quiz": []
    },
    {
      "id": "s1-g02-2",
      "title": "종교와 문화경관",
      "standard": {
        "code": "9사(지리)02-02",
        "text": "종교와 관련된 아시아의 다양한 문화경관과 생활양식을 파악하고, 세계시민으로서 문화 다양성에 대한 이해와 수용성을 높인다.",
        "verified": true
      },
      "mission": "우리 동네에서 종교와 관련된 건축물(교회·절·성당 등)을 찾아 눈에 띄는 특징을 찍어 보자.",
      "concepts": [],
      "quiz": []
    },
    {
      "id": "s1-g02-3",
      "title": "인구 구조의 변화",
      "standard": {
        "code": "9사(지리)02-03",
        "text": "아시아의 인구 특징을 파악하고 지역별 인구 구조 변화를 비교하여 지역 발전의 가능성 및 변화 모습을 추론한다.",
        "verified": true
      },
      "lab": {
        "type": "planned",
        "params": {
          "name": "인구 피라미드 3D 타임라인"
        }
      },
      "concepts": [],
      "quiz": []
    },
    {
      "id": "s1-g02-4",
      "title": "산업 변화와 우리나라",
      "standard": {
        "code": "9사(지리)02-04",
        "text": "글로컬 관점에서 아시아의 산업 특징과 변화를 파악하고, 이것이 우리나라 산업에 미치는 영향을 탐색한다.",
        "verified": true
      },
      "concepts": [],
      "quiz": []
    }
  ],
  "geo": {
    "lat": 32,
    "lng": 95
  }
}