{
  "id": "s1-g01",
  "book": "s1",
  "area": "지리",
  "no": 1,
  "title": "세계화 시대, 지리의 힘",
  "icon": "globe",
  "accent": "primary",
  "impact3d": 3,
  "standardsVerified": true,
  "lessons": [
    {
      "id": "s1-g01-1",
      "title": "위치와 환경으로 지역 읽기",
      "standard": {
        "code": "9사(지리)01-01",
        "text": "세계 여러 지역의 특성을 해당 지역의 위치와 자연⋅인문환경을 고려하여 추론한다.",
        "verified": true
      },
      "lab": {
        "type": "globe",
        "params": {
          "focus": [
            20,
            60
          ],
          "highlight": "world"
        }
      },
      "predict": {
        "q": "서울(동경 135° 표준시)이 오후 3시일 때, 경도 0°인 런던은 몇 시일까?",
        "choices": [
          "오전 6시",
          "오전 9시",
          "오후 6시",
          "자정"
        ],
        "answer": 0,
        "reveal": "경도 15°마다 1시간 차이가 난다. 135°는 9시간이므로 런던은 서울보다 9시간 늦은 오전 6시다. 지구본을 돌려 두 도시를 찾아보자."
      },
      "concepts": [
        {
          "term": "위치",
          "desc": "지구 위에서 어떤 장소가 있는 곳. 위도·경도로 나타내는 수리적 위치와 대륙·해양을 기준으로 한 지리적 위치가 있다."
        },
        {
          "term": "자연환경",
          "desc": "지형·기후·식생처럼 사람이 만들지 않은 환경. 생활 모습과 산업에 영향을 준다."
        },
        {
          "term": "인문환경",
          "desc": "인구·문화·산업·교통처럼 사람이 만든 환경."
        },
        {
          "term": "지역성",
          "desc": "자연환경과 인문환경이 어우러져 나타나는 그 지역만의 특성."
        }
      ],
      "quiz": [
        {
          "id": "q1",
          "q": "위도와 경도로 나타내는 위치를 무엇이라고 하는가?",
          "choices": [
            "지리적 위치",
            "수리적 위치",
            "관계적 위치",
            "상대적 위치"
          ],
          "answer": 1,
          "explain": "위도·경도처럼 숫자로 나타내는 위치는 수리적 위치다."
        },
        {
          "id": "q2",
          "q": "다음 중 인문환경에 해당하는 것은?",
          "choices": [
            "기후",
            "지형",
            "교통망",
            "식생"
          ],
          "answer": 2,
          "explain": "교통망은 사람이 만든 환경이므로 인문환경이다."
        },
        {
          "id": "q3",
          "q": "경도 15°마다 생기는 시간 차이는?",
          "choices": [
            "30분",
            "1시간",
            "2시간",
            "15분"
          ],
          "answer": 1,
          "explain": "지구는 24시간에 360° 자전하므로 15°마다 1시간 차이가 난다."
        }
      ]
    },
    {
      "id": "s1-g01-2",
      "title": "연결되는 세계",
      "standard": {
        "code": "9사(지리)01-02",
        "text": "다양한 스케일에서 지역이 서로 연계되어 있음을 공간적 상호 작용의 사례를 통해 파악한다.",
        "verified": true
      },
      "lab": {
        "type": "globe",
        "params": {
          "focus": [
            35,
            127
          ],
          "arcs": "network"
        }
      },
      "predict": {
        "q": "한국에서 미국으로 보내는 인터넷 데이터는 주로 무엇을 타고 갈까?",
        "choices": [
          "인공위성",
          "해저 케이블",
          "항공 화물",
          "무선 중계탑"
        ],
        "answer": 1,
        "reveal": "국제 인터넷 데이터는 대부분 바다 밑 광케이블로 오간다. 지구본의 선들이 한국과 세계 주요 도시를 잇는 연결이다."
      },
      "concepts": [],
      "quiz": []
    },
    {
      "id": "s1-g01-3",
      "title": "세계화와 지역화",
      "standard": {
        "code": "9사(지리)01-03",
        "text": "세계의 변화가 지역에 영향을 미치고 지역의 변화가 세계에 영향을 미치는 사례를 조사한다.",
        "verified": true
      },
      "mission": "집이나 마트에서 외국에서 온 물건 3가지를 찾아 원산지 표시를 찍어 보자.",
      "concepts": [],
      "quiz": []
    }
  ],
  "geo": {
    "lat": 20,
    "lng": 60
  }
}