{
  "id": "s1-g05",
  "book": "s1",
  "area": "지리",
  "no": 5,
  "title": "아메리카",
  "icon": "mountain",
  "accent": "green",
  "impact3d": 3,
  "standardsVerified": true,
  "lessons": [
    {
      "id": "s1-g05-1",
      "title": "아메리카의 위치와 자연환경",
      "standard": {
        "code": "9사(지리)05-01",
        "text": "다양한 지리 정보와 매체를 활용하여 아메리카의 국가와 주요 도시의 위치를 파악하고 자연환경의 특성을 지도로 표현한다.",
        "verified": true
      },
      "lab": {
        "type": "globe",
        "params": {
          "focus": [
            10,
            -80
          ],
          "highlight": "americas"
        }
      },
      "predict": {
        "q": "적도 근처 안데스 산지의 도시 키토(해발 약 2,800m)의 날씨는?",
        "choices": [
          "1년 내내 무덥다",
          "1년 내내 봄 같다",
          "겨울에 눈이 많이 온다",
          "사막처럼 건조하다"
        ],
        "answer": 1,
        "reveal": "고도가 높아 적도 근처인데도 연평균 기온이 15℃ 안팎이다. 이런 고산 기후 덕분에 안데스 고지대에 도시가 발달했다."
      },
      "concepts": [],
      "quiz": []
    },
    {
      "id": "s1-g05-2",
      "title": "인구 구성과 문화 혼종성",
      "standard": {
        "code": "9사(지리)05-02",
        "text": "다양한 민족(인종)으로 구성된 아메리카의 인구 특징을 살펴보고, 사례를 들어 아메리카의 문화 혼종성을 설명한다.",
        "verified": true
      },
      "concepts": [],
      "quiz": []
    },
    {
      "id": "s1-g05-3",
      "title": "초국적 기업과 지역 변화",
      "standard": {
        "code": "9사(지리)05-03",
        "text": "초국적 기업의 글로벌 생산체제에 대한 이해를 바탕으로, 초국적 기업의 아메리카 지역 내 입지와 해외 이전의 이유, 그에 따른 해당 지역의 변화를 분석한다.",
        "verified": true
      },
      "lab": {
        "type": "globe",
        "params": {
          "focus": [
            30,
            -100
          ],
          "arcs": "tnc"
        }
      },
      "predict": {
        "q": "미국 자동차 회사가 멕시코에 공장을 세우는 가장 큰 이유는?",
        "choices": [
          "멕시코 시장이 세계에서 가장 커서",
          "임금이 상대적으로 낮고 미국과 가까워서",
          "기술 수준이 더 높아서",
          "날씨가 좋아서"
        ],
        "answer": 1,
        "reveal": "생산비가 낮고 미국 시장과 가까운 곳에 공장을 두면 비용이 줄어든다. 초국적 기업은 본사·연구소·공장을 기능별로 다른 지역에 둔다."
      },
      "concepts": [],
      "quiz": []
    }
  ],
  "geo": {
    "lat": 10,
    "lng": -80
  }
}