{
  "id": "s2-g07",
  "book": "s2",
  "area": "지리",
  "no": 7,
  "title": "대한민국, 우리가 살아가는 곳",
  "icon": "flag",
  "accent": "primary",
  "impact3d": 3,
  "standardsVerified": false,
  "lessons": [
    {
      "id": "s2-g07-1",
      "title": "우리나라의 영역",
      "standard": {
        "code": null,
        "text": null,
        "verified": false
      },
      "lab": {
        "type": "planned",
        "params": {
          "name": "영해 기선 3D 해양 시각화"
        }
      },
      "concepts": [],
      "quiz": []
    },
    {
      "id": "s2-g07-2",
      "title": "독도",
      "standard": {
        "code": null,
        "text": null,
        "verified": false
      },
      "lab": {
        "type": "globe",
        "params": {
          "focus": [
            37.24,
            131.86
          ],
          "zoom": 2.2
        }
      },
      "predict": {
        "q": "맑은 날 울릉도에서 독도가 맨눈으로 보일까?",
        "choices": [
          "보인다",
          "보이지 않는다"
        ],
        "answer": 0,
        "reveal": "울릉도와 독도는 약 87.4km 떨어져 있어 맑은 날 맨눈으로 보인다. 독도가 울릉도 주민의 생활권이었다는 근거 가운데 하나다."
      },
      "concepts": [
        {
          "term": "독도",
          "desc": "울릉도에서 동남쪽으로 약 87.4km 떨어진 우리나라 동쪽 끝의 섬. 동도와 서도, 89개의 부속 도서로 이루어진 화산섬이다."
        },
        {
          "term": "영해",
          "desc": "기선으로부터 12해리까지의 바다. 대한해협 일부는 3해리를 적용한다."
        },
        {
          "term": "배타적 경제 수역",
          "desc": "기선으로부터 200해리까지 영해를 제외한 바다. 연안국이 자원 탐사·개발 권리를 가진다."
        }
      ],
      "quiz": [
        {
          "id": "q1",
          "q": "우리나라 영해의 범위(대한해협 제외)는 기선으로부터 몇 해리인가?",
          "choices": [
            "3해리",
            "12해리",
            "24해리",
            "200해리"
          ],
          "answer": 1,
          "explain": "우리나라는 대부분 해역에서 12해리를 영해로 적용한다."
        }
      ]
    },
    {
      "id": "s2-g07-3",
      "title": "우리나라의 위치와 지역",
      "standard": {
        "code": null,
        "text": null,
        "verified": false
      },
      "concepts": [],
      "quiz": []
    }
  ],
  "geo": {
    "lat": 37,
    "lng": 128
  }
}