{
  "id": "s1-g06",
  "book": "s1",
  "area": "지리",
  "no": 6,
  "title": "오세아니아와 극지방",
  "icon": "snow",
  "accent": "coral",
  "impact3d": 3,
  "standardsVerified": true,
  "lessons": [
    {
      "id": "s1-g06-1",
      "title": "오세아니아와 자원 연계",
      "standard": {
        "code": "9사(지리)06-01",
        "text": "다양한 지리 정보와 매체를 활용하여 오세아니아의 국가와 주요 도시의 위치, 자연환경의 특성을 파악하고, 자원 수출을 중심으로 세계 다른 지역과의 상호연계성을 탐색한다.",
        "verified": true
      },
      "lab": {
        "type": "globe",
        "params": {
          "focus": [
            -25,
            140
          ],
          "highlight": "oceania"
        }
      },
      "predict": {
        "q": "오스트레일리아가 가장 많이 수출하는 나라는?",
        "choices": [
          "미국",
          "영국",
          "중국",
          "뉴질랜드"
        ],
        "answer": 2,
        "reveal": "철광석·석탄 같은 자원을 가까운 아시아로 수출한다. 최대 상대국은 중국이고 일본·한국도 주요 상대국이다."
      },
      "concepts": [],
      "quiz": []
    },
    {
      "id": "s1-g06-2",
      "title": "태평양의 환경 문제",
      "standard": {
        "code": "9사(지리)06-02",
        "text": "태평양 지역이 겪고 있는 환경 문제를 조사하고 그 해결에 참여할 수 있는 방안을 제안한다.",
        "verified": true
      },
      "lab": {
        "type": "planned",
        "params": {
          "name": "해수면 상승 시뮬레이션"
        }
      },
      "concepts": [],
      "quiz": []
    },
    {
      "id": "s1-g06-3",
      "title": "극지방 개발과 이해관계",
      "standard": {
        "code": "9사(지리)06-03",
        "text": "극지방의 지리적 중요성과 지역 개발을 둘러싼 다양한 이해관계를 살펴보고, 이에 대한 자신과 상대방의 의견을 비판적으로 검토한다.",
        "verified": true
      },
      "lab": {
        "type": "globe",
        "params": {
          "focus": [
            75,
            40
          ],
          "highlight": "arctic"
        }
      },
      "predict": {
        "q": "북극 바다 얼음이 줄어들면 부산에서 유럽으로 가는 뱃길은?",
        "choices": [
          "더 길어진다",
          "북극항로로 더 짧아질 수 있다",
          "변화가 없다",
          "배가 다닐 수 없게 된다"
        ],
        "answer": 1,
        "reveal": "북극항로는 수에즈 운하를 거치는 항로보다 거리가 30% 이상 짧다. 그래서 극지방의 항로와 자원을 둘러싼 이해관계가 커지고 있다."
      },
      "concepts": [],
      "quiz": []
    }
  ],
  "geo": {
    "lat": -25,
    "lng": 140
  }
}