{
  "id": "s2-s09",
  "book": "s2",
  "area": "일반사회",
  "no": 9,
  "title": "시장과 가격",
  "icon": "chart",
  "accent": "magenta",
  "impact3d": 3,
  "standardsVerified": true,
  "lessons": [
    {
      "id": "s2-s09-1",
      "title": "시장의 의미와 필요성",
      "standard": {
        "code": "9사(일사)09-01",
        "text": "일상생활에서 접하는 다양한 시장의 사례를 조사하고, 이를 토대로 시장의 의미와 필요성을 설명한다.",
        "verified": true
      },
      "mission": "전통 시장·편의점·온라인 쇼핑 화면 중 2가지를 찍고, 시장이라는 점에서 같은 점을 적어 보자.",
      "concepts": [],
      "quiz": []
    },
    {
      "id": "s2-s09-2",
      "title": "수요·공급과 가격 결정",
      "standard": {
        "code": "9사(일사)09-02",
        "text": "수요 법칙과 공급 법칙을 사례를 통해 도출하고, 이를 토대로 시장 가격이 결정되는 원리를 설명한다.",
        "verified": true
      },
      "lab": {
        "type": "supply-demand",
        "params": {
          "mode": "equilibrium"
        }
      },
      "predict": {
        "q": "떡볶이 가격이 크게 오르면, 가게들이 팔려고 하는 떡볶이의 양은?",
        "choices": [
          "줄어든다",
          "늘어난다",
          "그대로다",
          "0이 된다"
        ],
        "answer": 1,
        "reveal": "가격이 오르면 공급량이 늘어난다(공급 법칙). 그래프의 가격선을 위아래로 끌어 직접 확인해 보자."
      },
      "concepts": [
        {
          "term": "수요 법칙",
          "desc": "다른 조건이 같을 때 가격이 오르면 수요량이 줄고, 가격이 내리면 수요량이 늘어난다."
        },
        {
          "term": "공급 법칙",
          "desc": "다른 조건이 같을 때 가격이 오르면 공급량이 늘고, 가격이 내리면 공급량이 줄어든다."
        },
        {
          "term": "균형 가격",
          "desc": "수요량과 공급량이 같아지는 가격. 시장은 이 가격으로 움직인다."
        },
        {
          "term": "초과 수요·초과 공급",
          "desc": "가격이 균형보다 낮으면 초과 수요가 생겨 가격이 오르고, 높으면 초과 공급이 생겨 가격이 내린다."
        }
      ],
      "quiz": [
        {
          "id": "q1",
          "q": "가격이 균형 가격보다 높을 때 나타나는 현상은?",
          "choices": [
            "초과 수요",
            "초과 공급",
            "수요 증가",
            "공급 감소"
          ],
          "answer": 1,
          "explain": "가격이 높으면 공급량이 수요량보다 많아 초과 공급이 생긴다."
        },
        {
          "id": "q2",
          "q": "수요 법칙에 따르면 가격이 오를 때 수요량은?",
          "choices": [
            "늘어난다",
            "줄어든다",
            "변하지 않는다",
            "공급량과 같아진다"
          ],
          "answer": 1,
          "explain": "가격과 수요량은 반대 방향으로 움직인다."
        },
        {
          "id": "q3",
          "q": "균형 가격에서 성립하는 것은?",
          "choices": [
            "수요량 > 공급량",
            "수요량 < 공급량",
            "수요량 = 공급량",
            "가격 = 0"
          ],
          "answer": 2,
          "explain": "균형 가격은 수요량과 공급량이 같아지는 가격이다."
        }
      ]
    },
    {
      "id": "s2-s09-3",
      "title": "가격 변동과 대응",
      "standard": {
        "code": "9사(일사)09-03",
        "text": "시장경제에서 수요와 공급을 변화시키는 요인을 조사하고, 시장 가격의 변동에 대응하는 방안을 계획한다.",
        "verified": true
      },
      "lab": {
        "type": "supply-demand",
        "params": {
          "mode": "shift"
        }
      },
      "predict": {
        "q": "태풍으로 배추 생산이 크게 줄었다. 배추 가격은 어떻게 될까?",
        "choices": [
          "오른다",
          "내린다",
          "그대로다",
          "알 수 없다"
        ],
        "answer": 0,
        "reveal": "공급이 줄면 공급 곡선이 왼쪽으로 움직여 균형 가격이 오른다. 오른쪽의 '태풍으로 생산 감소'를 눌러 확인해 보자."
      },
      "mission": "마트에서 최근 가격이 크게 바뀐 상품을 찾아 찍고, 수요와 공급 중 무엇 때문인지 추측해 보자.",
      "concepts": [
        {
          "term": "수요 변동 요인",
          "desc": "소득, 선호, 대체재·보완재 가격, 인구, 미래 가격 예상이 바뀌면 수요 곡선 전체가 이동한다."
        },
        {
          "term": "공급 변동 요인",
          "desc": "생산 비용, 기술, 공급자 수, 날씨 등이 바뀌면 공급 곡선 전체가 이동한다."
        }
      ],
      "quiz": [
        {
          "id": "q1",
          "q": "배추 산지에 태풍이 와서 생산이 줄었다. 배추 시장의 변화는?",
          "choices": [
            "공급 증가 → 가격 하락",
            "공급 감소 → 가격 상승",
            "수요 증가 → 가격 하락",
            "수요 감소 → 가격 상승"
          ],
          "answer": 1,
          "explain": "공급이 줄면 공급 곡선이 왼쪽으로 이동해 균형 가격이 오른다."
        },
        {
          "id": "q2",
          "q": "수요 곡선을 오른쪽으로 이동시키는 요인은?",
          "choices": [
            "상품 가격 상승",
            "생산 기술 발달",
            "소비자 선호 증가",
            "원자재 가격 상승"
          ],
          "answer": 2,
          "explain": "선호가 늘면 같은 가격에서 더 사려 하므로 수요가 증가한다. 상품 자체의 가격 변화는 곡선 위의 이동이다."
        }
      ]
    }
  ]
}