{
  "id": "s1-g04",
  "book": "s1",
  "area": "지리",
  "no": 4,
  "title": "아프리카",
  "icon": "sun",
  "accent": "orange",
  "impact3d": 3,
  "standardsVerified": true,
  "lessons": [
    {
      "id": "s1-g04-1",
      "title": "아프리카의 위치와 자연환경",
      "standard": {
        "code": "9사(지리)04-01",
        "text": "다양한 지리 정보와 매체를 활용하여 아프리카의 국가와 주요 도시의 위치를 파악하고 자연환경의 특성을 지도로 표현한다.",
        "verified": true
      },
      "lab": {
        "type": "globe",
        "params": {
          "focus": [
            3,
            22
          ],
          "highlight": "africa"
        }
      },
      "predict": {
        "q": "아프리카에서 가장 넓은 면적을 차지하는 기후는?",
        "choices": [
          "열대 우림 기후",
          "건조 기후",
          "온대 기후",
          "한대 기후"
        ],
        "answer": 1,
        "reveal": "사하라·칼라하리 같은 건조 기후 지역이 가장 넓다. 열대 우림은 적도 주변에 띠 모양으로 나타난다."
      },
      "concepts": [],
      "quiz": []
    },
    {
      "id": "s1-g04-2",
      "title": "문화와 지역 잠재력",
      "standard": {
        "code": "9사(지리)04-02",
        "text": "아프리카의 지리적 특성에 기반한 다양한 문화와 지역 잠재력을 탐구하고, 아프리카에 대한 자신의 인식을 성찰한다.",
        "verified": true
      },
      "concepts": [],
      "quiz": []
    },
    {
      "id": "s1-g04-3",
      "title": "지속가능한 발전과 협력",
      "standard": {
        "code": "9사(지리)04-03",
        "text": "지속가능한 발전을 위한 아프리카 각 지역의 노력과 세계 다양한 주체들의 협력 사례를 조사하고, 세계시민으로서 우리가 참여할 수 있는 방안을 모색한다.",
        "verified": true
      },
      "concepts": [],
      "quiz": []
    }
  ],
  "geo": {
    "lat": 3,
    "lng": 22
  }
}